Code	Region	V4 Valid	Pc	V4 Invalid	Pc	V4 Unknwn	Pc	V4 Total Routes	V6 Valid	Pc	V6 Invalid	Pc	V6 Unknwn	Pc	V6 Total Routes
VC	Saint Vincent and the Grenadines, Caribbean, Americas	18	32.7%	0	0.0%	37	67.3%	55	1	25.0%	0	0.0%	3	75.0%	4
VE	Venezuela, South America, Americas	2115	78.7%	19	0.7%	553	20.6%	2687	217	90.0%	1	0.4%	23	9.5%	241
VG	British Virgin Islands, Caribbean, Americas	45	20.3%	20	9.0%	157	70.7%	222	17	41.5%	0	0.0%	24	58.5%	41
VI	United States Virgin Islands, Caribbean, Americas	5	3.1%	0	0.0%	156	96.9%	161	18	90.0%	0	0.0%	2	10.0%	20
VN	Vietnam, South-Eastern Asia, Asia	16375	88.6%	570	3.1%	1546	8.4%	18491	8335	95.2%	5	0.1%	416	4.8%	8756
VU	Vanuatu, Melanesia, Oceania	55	94.8%	1	1.7%	2	3.4%	58	6	85.7%	0	0.0%	1	14.3%	7
WF	Wallis and Futuna Islands, Polynesia, Oceania	1	6.7%	0	0.0%	14	93.3%	15	1	100.0%	0	0.0%	0	0.0%	1
WS	Samoa, Polynesia, Oceania	48	84.2%	0	0.0%	9	15.8%	57	1	50.0%	0	0.0%	1	50.0%	2
YE	Yemen, Western Asia, Asia	115	73.7%	0	0.0%	41	26.3%	156	10	100.0%	0	0.0%	0	0.0%	10
YT	Mayotte, Eastern Africa, Africa	5	38.5%	0	0.0%	8	61.5%	13	1	100.0%	0	0.0%	0	0.0%	1
ZA	South Africa, Southern Africa, Africa	3982	34.8%	1603	14.0%	5851	51.2%	11436	535	51.2%	91	8.7%	418	40.0%	1044
ZM	Zambia, Eastern Africa, Africa	147	53.5%	0	0.0%	128	46.5%	275	19	100.0%	0	0.0%	0	0.0%	19
ZW	Zimbabwe, Eastern Africa, Africa	104	24.9%	1	0.2%	312	74.8%	417	10	66.7%	0	0.0%	5	33.3%	15
